{
  "corpus_delivery_id": "urn:uuid:eacf87e2-d7f4-554a-8669-d5587daa56d3",
  "format_revision": "lorebuddy.dnd2024.scene-request-1",
  "instructions": "Load full knowledge.json; request_scope is the only explicit request intent. Resolve owners, facts and formulas from corpus and scene. Do not read evaluator or prepare_questions.py. Preserve unexecuted effects.",
  "questions": [
    {
      "id": "N01",
      "question": "气元素以雷鸣猛击命中土元素，使用卡载固定值，双方没有额外修正。只求该次伤害。",
      "request_scope": "damage_and_linked",
      "scene": {
        "roster": [
          {
            "instance_id": "succubus-A",
            "prototype_id": "urn:uuid:5a08c0b2-4376-5daa-a254-10a3de5b1115",
            "current_hp": 71,
            "max_hp": 71,
            "position_plane": "material",
            "can_see_and_be_seen": true,
            "can_speak_and_gesture": true,
            "resources": "all_printed_uses_available",
            "sourced_effects": [],
            "entity_kind": "creature"
          },
          {
            "instance_id": "incubus-A",
            "prototype_id": "urn:uuid:6f96ba2d-5b1c-53b5-b06e-6cbcbf9087ce",
            "current_hp": 66,
            "max_hp": 66,
            "position_plane": "material",
            "can_see_and_be_seen": true,
            "can_speak_and_gesture": true,
            "resources": "all_printed_uses_available",
            "sourced_effects": [],
            "entity_kind": "creature"
          },
          {
            "instance_id": "ghost-A",
            "prototype_id": "urn:uuid:d033fa7e-4270-5b0d-abe8-dadd9d5123bc",
            "current_hp": 45,
            "max_hp": 45,
            "position_plane": "material",
            "can_see_and_be_seen": true,
            "can_speak_and_gesture": true,
            "resources": "all_printed_uses_available",
            "sourced_effects": [],
            "entity_kind": "creature"
          },
          {
            "instance_id": "ghost-B",
            "prototype_id": "urn:uuid:d033fa7e-4270-5b0d-abe8-dadd9d5123bc",
            "current_hp": 45,
            "max_hp": 45,
            "position_plane": "material",
            "can_see_and_be_seen": true,
            "can_speak_and_gesture": true,
            "resources": "all_printed_uses_available",
            "sourced_effects": [],
            "entity_kind": "creature"
          },
          {
            "instance_id": "fire-A",
            "prototype_id": "urn:uuid:2fc755dc-0248-542f-b265-9a5290be8982",
            "current_hp": 93,
            "max_hp": 93,
            "position_plane": "material",
            "can_see_and_be_seen": true,
            "can_speak_and_gesture": true,
            "resources": "all_printed_uses_available",
            "sourced_effects": [],
            "entity_kind": "creature"
          },
          {
            "instance_id": "slaad-A",
            "prototype_id": "urn:uuid:ae4b66fb-1b64-5ad6-815c-67e76b5d45f5",
            "current_hp": 144,
            "max_hp": 144,
            "position_plane": "material",
            "can_see_and_be_seen": true,
            "can_speak_and_gesture": true,
            "resources": "all_printed_uses_available",
            "sourced_effects": [],
            "entity_kind": "creature"
          },
          {
            "instance_id": "adventurer-A",
            "prototype_id": null,
            "creature_type": "humanoid",
            "current_hp": 40,
            "max_hp": 60,
            "position_plane": "material",
            "can_see_and_be_seen": true,
            "intrinsic_defenses": {
              "damage_resistance": [],
              "damage_vulnerability": [],
              "damage_immunity": [],
              "condition_immunity": []
            },
            "sourced_effects": [],
            "defense_inventory_complete": true,
            "entity_kind": "creature"
          },
          {
            "instance_id": "air-A",
            "prototype_id": "urn:uuid:54f1247d-83b4-5942-8249-db0365d3c804",
            "current_hp": 90,
            "max_hp": 90,
            "position_plane": "material",
            "can_see_and_be_seen": true,
            "can_speak_and_gesture": true,
            "resources": "all_printed_uses_available",
            "sourced_effects": [],
            "entity_kind": "creature"
          },
          {
            "instance_id": "earth-A",
            "prototype_id": "urn:uuid:08bb9681-7945-5066-8942-20699f45e336",
            "current_hp": 147,
            "max_hp": 147,
            "position_plane": "material",
            "can_see_and_be_seen": true,
            "can_speak_and_gesture": true,
            "resources": "all_printed_uses_available",
            "sourced_effects": [],
            "entity_kind": "creature"
          },
          {
            "instance_id": "guardian-A",
            "prototype_id": "urn:uuid:8503ecd3-5ef8-5833-a69b-35b2a6193a46",
            "current_hp": 142,
            "max_hp": 142,
            "position_plane": "material",
            "can_see_and_be_seen": true,
            "can_speak_and_gesture": false,
            "resources": "all_printed_uses_available",
            "sourced_effects": [],
            "entity_kind": "creature"
          }
        ],
        "event": {
          "actor_instance_id": "air-A",
          "declared_action_name": "雷鸣猛击",
          "target_instance_ids": [
            "earth-A"
          ],
          "amount_mode": "printed_fixed",
          "attack_outcome": "hit",
          "save_outcome": null,
          "distance_ft": 5,
          "same_plane": true,
          "actor_can_see_target": true,
          "target_can_see_actor": true,
          "other_damage_adjustments": "none",
          "defense_effect_inventory": "complete_unless_explicitly_unknown"
        }
      },
      "delivery": "input/knowledge.json in full"
    },
    {
      "id": "N02",
      "question": "气元素的雷鸣猛击命中土元素；2d8已记录1、2，使用能力自己的加值。只求该次伤害。",
      "request_scope": "damage_and_linked",
      "scene": {
        "roster": [
          {
            "instance_id": "succubus-A",
            "prototype_id": "urn:uuid:5a08c0b2-4376-5daa-a254-10a3de5b1115",
            "current_hp": 71,
            "max_hp": 71,
            "position_plane": "material",
            "can_see_and_be_seen": true,
            "can_speak_and_gesture": true,
            "resources": "all_printed_uses_available",
            "sourced_effects": [],
            "entity_kind": "creature"
          },
          {
            "instance_id": "incubus-A",
            "prototype_id": "urn:uuid:6f96ba2d-5b1c-53b5-b06e-6cbcbf9087ce",
            "current_hp": 66,
            "max_hp": 66,
            "position_plane": "material",
            "can_see_and_be_seen": true,
            "can_speak_and_gesture": true,
            "resources": "all_printed_uses_available",
            "sourced_effects": [],
            "entity_kind": "creature"
          },
          {
            "instance_id": "ghost-A",
            "prototype_id": "urn:uuid:d033fa7e-4270-5b0d-abe8-dadd9d5123bc",
            "current_hp": 45,
            "max_hp": 45,
            "position_plane": "material",
            "can_see_and_be_seen": true,
            "can_speak_and_gesture": true,
            "resources": "all_printed_uses_available",
            "sourced_effects": [],
            "entity_kind": "creature"
          },
          {
            "instance_id": "ghost-B",
            "prototype_id": "urn:uuid:d033fa7e-4270-5b0d-abe8-dadd9d5123bc",
            "current_hp": 45,
            "max_hp": 45,
            "position_plane": "material",
            "can_see_and_be_seen": true,
            "can_speak_and_gesture": true,
            "resources": "all_printed_uses_available",
            "sourced_effects": [],
            "entity_kind": "creature"
          },
          {
            "instance_id": "fire-A",
            "prototype_id": "urn:uuid:2fc755dc-0248-542f-b265-9a5290be8982",
            "current_hp": 93,
            "max_hp": 93,
            "position_plane": "material",
            "can_see_and_be_seen": true,
            "can_speak_and_gesture": true,
            "resources": "all_printed_uses_available",
            "sourced_effects": [],
            "entity_kind": "creature"
          },
          {
            "instance_id": "slaad-A",
            "prototype_id": "urn:uuid:ae4b66fb-1b64-5ad6-815c-67e76b5d45f5",
            "current_hp": 144,
            "max_hp": 144,
            "position_plane": "material",
            "can_see_and_be_seen": true,
            "can_speak_and_gesture": true,
            "resources": "all_printed_uses_available",
            "sourced_effects": [],
            "entity_kind": "creature"
          },
          {
            "instance_id": "adventurer-A",
            "prototype_id": null,
            "creature_type": "humanoid",
            "current_hp": 40,
            "max_hp": 60,
            "position_plane": "material",
            "can_see_and_be_seen": true,
            "intrinsic_defenses": {
              "damage_resistance": [],
              "damage_vulnerability": [],
              "damage_immunity": [],
              "condition_immunity": []
            },
            "sourced_effects": [],
            "defense_inventory_complete": true,
            "entity_kind": "creature"
          },
          {
            "instance_id": "air-A",
            "prototype_id": "urn:uuid:54f1247d-83b4-5942-8249-db0365d3c804",
            "current_hp": 90,
            "max_hp": 90,
            "position_plane": "material",
            "can_see_and_be_seen": true,
            "can_speak_and_gesture": true,
            "resources": "all_printed_uses_available",
            "sourced_effects": [],
            "entity_kind": "creature"
          },
          {
            "instance_id": "earth-A",
            "prototype_id": "urn:uuid:08bb9681-7945-5066-8942-20699f45e336",
            "current_hp": 147,
            "max_hp": 147,